{
  "$schema": "../../schema.json",
  "model_id": "Qwen/Qwen3.5-4B",
  "license": {
    "name": "Apache 2.0",
    "url": "https://huggingface.co/Qwen/Qwen3.5-4B/blob/main/LICENSE"
  },
  "architecture": "dense",
  "last_validated": {
    "long/h200-inference-full": null,
    "long/h200-inference-lora": null,
    "long/h200-training-full": null,
    "long/h200-training-lora": null,
    "standard/h200-inference-full": null,
    "standard/h200-inference-lora": null,
    "standard/h200-training-full": "2026-09-02",
    "standard/h200-training-lora": "2026-09-02"
  }
}
