{
  "$schema": "../../schema.json",
  "model_id": "google/gemma-3-4b-it",
  "license": {
    "name": "Gemma",
    "url": "https://ai.google.dev/gemma/terms"
  },
  "architecture": "dense",
  "last_validated": {
    "long/h200-inference-full": null,
    "long/h200-training-full": null,
    "standard/h200-inference-full": null,
    "standard/h200-training-full": null
  }
}
