{
  "$schema": "../../schema.json",
  "model_id": "Qwen/Qwen3-4B-Instruct-2507",
  "license": {
    "name": "Apache 2.0",
    "url": "https://huggingface.co/Qwen/Qwen3-4B-Instruct-2507/blob/main/LICENSE"
  },
  "architecture": "dense",
  "last_validated": {
    "long/h200-inference-full": null,
    "long/h200-training-full": null,
    "standard/h200-inference-full": null,
    "standard/h200-training-full": null
  }
}
