{
  "$schema": "../../schema.json",
  "model_id": "nvidia/NVIDIA-Nemotron-3-Nano-30B-A3B-BF16",
  "license": {
    "name": "NVIDIA Nemotron Open Model License",
    "url": "https://www.nvidia.com/en-us/agreements/enterprise-software/nvidia-nemotron-open-model-license/"
  },
  "architecture": "moe",
  "moe": {
    "num_moe_layers": 23,
    "topk": 6,
    "num_experts": 128
  },
  "last_validated": {
    "long/h200-inference-full": null,
    "long/h200-training-full": null,
    "standard/h200-inference-full": null,
    "standard/h200-training-full": null
  }
}
