{
  "$schema": "../../schema.json",
  "model_id": "deepseek-ai/DeepSeek-V4.1-Flash-1017",
  "license": {
    "name": "MIT",
    "url": "https://huggingface.co/deepseek-ai/DeepSeek-V4.1-Flash-1017/blob/main/LICENSE"
  },
  "architecture": "moe",
  "moe": {
    "num_moe_layers": 40,
    "topk": 6,
    "num_experts": 384
  },
  "last_validated": {
    "long/h200-inference-lora": null,
    "long/h200-training-full": "2026-10-23",
    "long/h200-training-lora": "2026-10-26",
    "standard/h200-inference-lora": null,
    "standard/h200-training-full": "2026-10-23",
    "standard/h200-training-lora": "2026-10-26"
  }
}
