{
  "$schema": "../../schema.json",
  "model_id": "zai-org/GLM-5.3-Flash-BF16",
  "license": {
    "name": "MIT",
    "url": "https://huggingface.co/zai-org/GLM-5.3-Flash-BF16/blob/main/LICENSE"
  },
  "architecture": "moe",
  "moe": {
    "num_moe_layers": 42,
    "topk": 8,
    "num_experts": 288
  },
  "last_validated": {
    "long/h200-inference-full": null,
    "long/h200-training-full": null,
    "standard/h200-inference-full": null,
    "standard/h200-training-full": null
  }
}
