{
  "$schema": "../../schema.json",
  "model_id": "zai-org/GLM-5.2",
  "license": {
    "name": "MIT",
    "url": "https://huggingface.co/zai-org/GLM-5.2/blob/main/LICENSE"
  },
  "architecture": "moe",
  "moe": {
    "num_moe_layers": 78,
    "topk": 8,
    "num_experts": 256
  },
  "last_validated": {
    "standard/h200-inference-full": null
  }
}
